{
  "id": "capability.docara.publish-github-pages",
  "schema_version": "1.0.0",
  "kind": "capability",
  "title": "Publish GitHub Pages",
  "summary": "Prepare GitHub Pages workflow and publication checks.",
  "owner": "docara",
  "lifecycle": "active",
  "readiness": "pilot",
  "confidence": 0.86,
  "confidence_method": "human_asserted_from_skill_contract",
  "evidence_status": "asserted_by_human",
  "source_refs": [
    "skills/docara/SKILL.md",
    "skills/docara/references/github-pages.md",
    "skills/docara/scripts/create-github-pages-workflow.py"
  ],
  "evidence_refs": [],
  "tags": [
    "skill",
    "growgraph-runtime",
    "capability-profile",
    "docara",
    "capability",
    "capability"
  ],
  "subtype": "skill_capability"
}
