{
  "id": "capability.docara.project-setup",
  "schema_version": "1.0.0",
  "kind": "capability",
  "title": "Docara project setup",
  "summary": "Prepare Docara project model and source structure.",
  "owner": "docara",
  "lifecycle": "active",
  "readiness": "pilot",
  "confidence": 0.86,
  "confidence_method": "human_asserted_from_skill_contract",
  "evidence_status": "asserted_by_human",
  "source_refs": [
    "skills/docara/SKILL.md",
    "skills/docara/references/project-model.md",
    "skills/docara/scripts/prepare-docara-project.php"
  ],
  "evidence_refs": [],
  "tags": [
    "skill",
    "mirai-graph-runtime",
    "capability-profile",
    "docara",
    "capability",
    "capability"
  ],
  "subtype": "skill_capability"
}
