{
  "id": "capability.docara.theme-branding",
  "schema_version": "1.0.0",
  "kind": "capability",
  "title": "Theme and branding",
  "summary": "Apply Docara theme variables and branding workflow.",
  "owner": "docara",
  "lifecycle": "active",
  "readiness": "pilot",
  "confidence": 0.86,
  "confidence_method": "human_asserted_from_skill_contract",
  "evidence_status": "asserted_by_human",
  "source_refs": [
    "skills/docara/SKILL.md",
    "skills/docara/references/theme-workflow.md",
    "skills/docara/scripts/docara-theme-vars.php"
  ],
  "evidence_refs": [],
  "tags": [
    "skill",
    "mirai-graph-runtime",
    "capability-profile",
    "docara",
    "capability",
    "capability"
  ],
  "subtype": "skill_capability"
}
