{
  "id": "policy.docara.docs-owner-boundary",
  "schema_version": "1.0.0",
  "kind": "policy",
  "title": "Docs owner boundary",
  "summary": "Docara publishes site structure; docs skill owns content method and quality.",
  "owner": "docara",
  "lifecycle": "active",
  "readiness": "pilot",
  "confidence": 0.86,
  "confidence_method": "human_asserted_from_skill_contract",
  "evidence_status": "asserted_by_human",
  "source_refs": [
    "skills/docara/SKILL.md",
    "skills/docara/rules/skill-mesh-balance.md"
  ],
  "evidence_refs": [],
  "tags": [
    "skill",
    "growgraph-runtime",
    "capability-profile",
    "docara",
    "policy",
    "policy"
  ],
  "subtype": "skill_policy"
}
