{
  "id": "capability.docara.authoring-frontmatter",
  "schema_version": "1.0.0",
  "kind": "capability",
  "title": "Authoring and front matter",
  "summary": "Apply authoring rules, front matter and content import expectations.",
  "owner": "docara",
  "lifecycle": "active",
  "readiness": "pilot",
  "confidence": 0.86,
  "confidence_method": "human_asserted_from_skill_contract",
  "evidence_status": "asserted_by_human",
  "source_refs": [
    "skills/docara/SKILL.md",
    "skills/docara/references/authoring-rules.md",
    "skills/docara/scripts/import-markdown-docs.php"
  ],
  "evidence_refs": [],
  "tags": [
    "skill",
    "growgraph-runtime",
    "capability-profile",
    "docara",
    "capability",
    "capability"
  ],
  "subtype": "skill_capability"
}
